{
  "coverage": {
    "capture_mode": "synthetic_full",
    "captured_layers": [
      0,
      1,
      40,
      41
    ],
    "context_window_limit": null,
    "instrumented_generated_tokens": 1,
    "instrumented_tokens": 2,
    "requested_layers": [
      0,
      1,
      40,
      41
    ],
    "source_messages_total": 1,
    "source_tokens_total": 2,
    "status": "complete",
    "transmitted_messages": 1,
    "transmitted_tokens": 2,
    "truncated_message_indices": [],
    "truncated_tokens": 0,
    "warnings": []
  },
  "derived": {},
  "error": null,
  "experiment_id": "build-week-demo",
  "provenance": {
    "backend": "mock",
    "canonical_result_sha256": "501c796d7e6bb44d69849b2569b9e8706cd1051a95c201c0aeadfbd0f1ac84bd",
    "code_version": "0.3.0-buildweek",
    "created_at": "2026-07-18T00:00:00Z",
    "environment": {
      "origin": "synthetic demo"
    },
    "raw_sha256": "1111111111111111111111111111111111111111111111111111111111111111",
    "request_sha256": "562171c71cad4472a58fb929e18d54d61280d86c17cc8be21650f28d63517584"
  },
  "quality": {
    "duplicate_of": null,
    "independent_observation": true,
    "prompt_copy_terms": [],
    "validation": "passed",
    "warnings": [
      "Synthetic Build Week demo data."
    ]
  },
  "raw": {
    "byte_length": 0,
    "content_type": "application/json",
    "format": "mock-json",
    "immutable": true,
    "relative_path": "demo"
  },
  "request": {
    "backend": "mock",
    "factors": {
      "demo": true
    },
    "generation": {},
    "intervention": null,
    "model": {
      "model_id": "synthetic/demo"
    },
    "prompt": "Demo prompt",
    "prompt_id": "demo",
    "readout": {
      "layers": [
        0,
        1,
        40,
        41
      ],
      "types": [
        "JACOBIAN_LENS"
      ]
    },
    "repeat": 1
  },
  "result": {
    "done": {
      "completion": " same",
      "mock": true
    },
    "meta": {
      "layers_by_type": {
        "JACOBIAN_LENS": [
          0,
          1,
          40,
          41
        ]
      },
      "mock": true,
      "types": [
        "JACOBIAN_LENS"
      ]
    },
    "tokens": [
      {
        "id": 101,
        "is_generated": false,
        "kind": "token",
        "position": 0,
        "results": [
          {
            "top_probs": [
              [
                0.7,
                0.2,
                0.1
              ],
              [
                0.7,
                0.2,
                0.1
              ],
              [
                0.7,
                0.2,
                0.1
              ],
              [
                0.7,
                0.2,
                0.1
              ]
            ],
            "top_tokens": [
              [
                " same",
                " path",
                " demo"
              ],
              [
                " same",
                " path",
                " demo"
              ],
              [
                " same",
                " path",
                " demo"
              ],
              [
                " same",
                " path",
                " demo"
              ]
            ],
            "type": "JACOBIAN_LENS"
          }
        ],
        "token": "Demo"
      },
      {
        "id": 102,
        "is_generated": false,
        "kind": "token",
        "position": 1,
        "results": [
          {
            "top_probs": [
              [
                0.7,
                0.2,
                0.1
              ],
              [
                0.7,
                0.2,
                0.1
              ],
              [
                0.7,
                0.2,
                0.1
              ],
              [
                0.7,
                0.2,
                0.1
              ]
            ],
            "top_tokens": [
              [
                " same",
                " path",
                " demo"
              ],
              [
                " same",
                " path",
                " demo"
              ],
              [
                " same",
                " path",
                " demo"
              ],
              [
                " same",
                " path",
                " demo"
              ]
            ],
            "type": "JACOBIAN_LENS"
          }
        ],
        "token": " prompt"
      },
      {
        "id": 201,
        "is_generated": true,
        "kind": "token",
        "position": 2,
        "results": [
          {
            "top_probs": [
              [
                0.7,
                0.2,
                0.1
              ],
              [
                0.7,
                0.2,
                0.1
              ],
              [
                0.7,
                0.2,
                0.1
              ],
              [
                0.7,
                0.2,
                0.1
              ]
            ],
            "top_tokens": [
              [
                " same",
                " path",
                " demo"
              ],
              [
                " same",
                " path",
                " demo"
              ],
              [
                " same",
                " path",
                " demo"
              ],
              [
                " same",
                " path",
                " demo"
              ]
            ],
            "type": "JACOBIAN_LENS"
          }
        ],
        "token": " same"
      }
    ]
  },
  "run_id": "demo-pair-b-control",
  "schema": "prismora.run/v2",
  "status": "ok"
}
