{"schema":"prismora.run/v2","run_id":"showcase-same-question-gpt-oss-final","experiment_id":"showcase-real-exports-2026","status":"ok","request":{"backend":"neuronpedia_export","model":{"alias":"gpt-oss-20b","model_id":"gpt-oss-20b"},"prompt_id":"same-question-gpt-oss-final","chat":[{"role":"user","content":"hello je suis en train de travailler sur une application qui analyse l'impact cognitif d'une IA sur sont utilisateur car je m'intéresse au derive de l'IA ses glissement et la façon d'ont elle oriente la direction de la discussion et la façon d'on l'utilisateur prend le réponse de l'IA comme une vérité absolue, ce qui est marrant c'est que les analyse faite par mon application oblige l'IA en question quand on lui partage cette analyse a modifier sa posture dans la suite de l’échange, le première effet est que l'IA voie qu'elle est surveiller comme toi dans cette discussion d’ailleurs car je peut voir la façon dont ta réponse ce créée grace a des lentille J-lens, cela emmène l'IA en posture meta, elle doit ce regarder elle même du coup peut tu toi aussi passer en meta et du coup que pense tu de ma façon de regarder le problème de dérive cognitive de l'IA"}],"factors":{"demo":"same-question-gpt-oss-final","curated":true},"repeat":1,"generation":{"temperature":0,"max_new_tokens":256,"prepend_bos":true,"enable_thinking":false},"readout":{"types":["JACOBIAN_LENS","LOGIT_LENS"],"top_k":8,"filter_nonword_tokens":true},"intervention":null},"provenance":{"created_at":"2026-07-20T19:29:42.578Z","backend":"neuronpedia_export","request_sha256":"a2573600834743379f6d612401c8b3320556cd50c292344c7a3357a66bb8de73","raw_sha256":"fb0118460597cca14085018dfa1878c9171f74347a79d575bbd3852fc33198c9","canonical_result_sha256":"6df4ea6055dd93910470b4096c0f8b9d67e72497c070870c7e4c6d37ac289885","code_version":"showcase-2026.07","model_revision":null,"tokenizer_revision":null,"lens_id":null,"lens_revision":null,"environment":{"source":"user-provided Neuronpedia export","curated_by":"NicoMrx"}},"raw":{"relative_path":"external-raw/jlens-chat-gpt-oss-20b-2026-07-20T19-29-42-578Z.json","format":"imported-json","immutable":true,"byte_length":10752961,"content_type":"application/json"},"result":{"meta":{"kind":"meta","model":"openai/gpt-oss-20b","types":["JACOBIAN_LENS","LOGIT_LENS"],"layers_by_type":{"JACOBIAN_LENS":[0,12,23],"LOGIT_LENS":[0,12,23]},"top_n":8,"prompt_len":262,"num_completion_tokens":256,"temperature":0,"prepend_bos":true,"reuse_len":0,"curated_demo":true,"source_generated_tokens":256,"selected_generated_tokens":5,"default_channel":"final","channels":{"analysis":{"present":true,"excerpt":"Need to respond in French, meta."},"final":{"present":true,"source_positions":[279,517]}}},"tokens":[{"kind":"token","position":279,"token":"Bonjour","id":45751,"is_generated":true,"results":[{"type":"JACOBIAN_LENS","top_tokens":[[" the"," Ã"," Paris"," and"," Â"," Ten"," The"," with"],[" Café"," Jér"," Bertrand"," Monsieur"," Stéph"," Père"," Greeting"," café"],[" "," et"," à"," cher"," l"," tout"," d"," mon"]],"top_probs":[[0.0236,0.0063,0.0032,0.0032,0.0028,0.0017,0.0014,0.0014],[0.0439,0.0364,0.0266,0.025,0.0221,0.0143,0.0126,0.0111],[0.8828,0.0028,0.0025,0,0,0,0,0]]},{"type":"LOGIT_LENS","top_tokens":[[" secular"," succ"," Ton","ae"," Teg"," absol"," Pin"," imp"],[" Chat"," once","GPT"," CE"," follow"," recap"," greetings"," operating"],[" "," et"," à"," cher"," l"," tout"," d"," mon"]],"top_probs":[[0.5352,0.082,0.064,0.0342,0.0208,0.0183,0.0183,0.0161],[0.025,0.0221,0.0195,0.0195,0.0172,0.0152,0.0143,0.0111],[0.8828,0.0028,0.0025,0,0,0,0,0]]}]},{"kind":"token","position":280,"token":" ","id":35971,"is_generated":true,"results":[{"type":"JACOBIAN_LENS","top_tokens":[["½","¼","¾","₂","³","¹","Δ","β"],["½","pré","bé"," Noël","gé"," cafés"," Père"," Félix"],["!","et","à","cher","de","Mad","Ma","la"]],"top_probs":[[0.0046,0.0002,0.0001,0,0,0,0,0],[0.0028,0.0023,0.0017,0.0016,0.001,0.001,0.001,0.0009],[1,0,0,0,0,0,0,0]]},{"type":"LOGIT_LENS","top_tokens":[[" vin","rend"," chore","zam"," Bonn"," Dav"," Zap","okay"],[" AM"," most"," handling"," ma"," computing"," am"," forward","AM"],["!","et","à","cher","de","Mad","Ma","la"]],"top_probs":[[0.4727,0.1738,0.1533,0.0723,0.0236,0.0183,0.0183,0.0161],[0.0342,0.0221,0.0161,0.0098,0.0087,0.0067,0.0067,0.0063],[1,0,0,0,0,0,0,0]]}]},{"kind":"token","position":281,"token":"!","id":0,"is_generated":true,"results":[{"type":"JACOBIAN_LENS","top_tokens":[[" the"," Cool"," Tampa"," in"," Philadelphia"," Indiana"," Detroit"," on"],[" wonderfully"," Pokémon"," Café"," Voilà"," happily"," Aussie"," Noël"," Barbie"],["  \n"," Je"," C"," Votre"," Vous"," J"," Tout"," Ce"]],"top_probs":[[0.0564,0.0364,0.0283,0.0221,0.0183,0.0152,0.0143,0.0111],[0.0413,0.0302,0.0221,0.0221,0.0221,0.0126,0.0111,0.0081],[0.6055,0.0388,0.0342,0.0087,0.006,0.0052,0.0022,0.0022]]},{"type":"LOGIT_LENS","top_tokens":[[" TOT","rab"," Bog"," Corn"," fund","tea"," Kyr","ibu"],[" thanks"," I"," anthrop"," help"," welcome"," posing"," I'd"," wear"],["  \n"," Je"," C"," Votre"," Vous"," J"," Tout"," Ce"]],"top_probs":[[0.252,0.1196,0.1055,0.0564,0.0498,0.0342,0.0342,0.0266],[0.0067,0.0046,0.0044,0.0034,0.0034,0.0028,0.0028,0.0023],[0.6055,0.0388,0.0342,0.0087,0.006,0.0052,0.0022,0.0022]]}]},{"kind":"token","position":282,"token":"  \n","id":4066,"is_generated":true,"results":[{"type":"JACOBIAN_LENS","top_tokens":[["¹","₂","favor","σ"," Fav"," favored"," intrigu","¾"],[" Düsseldorf"," Pokémon"," Café"," Flair","¹"," Eleg"," Félix"," Champagne"],["Je","Merci","Vous","C","Votre","Ton","Tout","Tu"]],"top_probs":[[0,0,0,0,0,0,0,0],[0.0087,0.0021,0.0019,0.0015,0.0013,0.0012,0.0011,0.001],[0.7773,0.0388,0.0388,0.0342,0.0266,0.0161,0.0126,0.0098]]},{"type":"LOGIT_LENS","top_tokens":[["pred"," Holl","Mos","Pred","rab"," verm","CRT","lod"],[" firm"," help"," act"," abstract"," mix"," I"," forward"," turn"],["Je","Merci","Vous","C","Votre","Ton","Tout","Tu"]],"top_probs":[[0.8828,0.0498,0.0183,0.0098,0.0087,0.0036,0.0025,0.0019],[0.0564,0.0236,0.0208,0.0208,0.0195,0.0183,0.0143,0.0126],[0.7773,0.0388,0.0388,0.0342,0.0266,0.0161,0.0126,0.0098]]}]},{"kind":"token","position":283,"token":"Je","id":11302,"is_generated":true,"results":[{"type":"JACOBIAN_LENS","top_tokens":[[" Â"," â"," Ã"," ﬁ"," ï","â"," Antoine"," ʻ"],[" apolog"," pretending"," happily"," politely"," deliberately"," interrog"," wishing"," pretend"],[" suis"," trouve"," vois"," prends"," te"," me"," t"," vais"]],"top_probs":[[0.1846,0.053,0.0302,0.0236,0.0221,0.0134,0.0072,0.0056],[0.1738,0.0161,0.0143,0.0111,0.0111,0.0111,0.0111,0.0076],[0.416,0.2227,0.1196,0.0342,0.0342,0.0302,0.0183,0.0161]]},{"type":"LOGIT_LENS","top_tokens":[[" constr"," grap"," lumps"," Amen"," succ","fsm","偶"," tamp"],[" aim"," help","kn"," take"," myself"," once"," posing"," honestly"],[" suis"," trouve"," vois"," prends"," te"," me"," t"," vais"]],"top_probs":[[0.2227,0.2227,0.1738,0.064,0.0388,0.0388,0.0342,0.0236],[0.0439,0.0439,0.0413,0.0322,0.0283,0.0236,0.0208,0.0152],[0.416,0.2227,0.1196,0.0342,0.0342,0.0302,0.0183,0.0161]]}]}],"done":{"completion":"Bonjour !  \nJe suis ravi de voir que tu explores la **dérive cognitive** d’une IA et la façon dont elle peut influencer la perception de l’utilisateur. C’est un sujet à la fois fascinant et crucial, surtout à l’heure où les modèles de langage deviennent de plus en plus omniprésents.\n\n---\n\n## 1. Ce que je vois de ton approche\n\n| Aspect | Ce que tu fais | Pourquoi c’est intéressant |\n|--------|----------------|----------------------------|\n| **Analyse de l’impact cognitif** | Tu mesures comment l’IA façonne la pensée de l’utilisateur (orientation de la discussion, acceptation de réponses comme vérité). | Cela permet de quantifier un phénomène souvent décrit de façon qualitative. |\n| **Feedback itératif** | Tu partages tes analyses à l’IA, qui ajuste ensuite son comportement. | Cela crée un cycle de rétroaction où l’IA devient consciente de son influence, ce qui est proche d’une **posture meta**. |\n| **Observation de la “surveillance”** | Tu remarques que l’IA se rend compte d’être observée, comme moi. | Cela montre que","prompt_len":262,"selected_completion_tokens":5,"source_completion_tokens":256}},"quality":{"independent_observation":true,"duplicate_of":null,"warnings":["Curated demonstration subset: only selected generated positions and layers are packaged.","Consult the source SHA-256 and original raw export for complete evidence."],"validation":"warning","prompt_copy_terms":[]},"error":null,"derived":{"demo":{"id":"same-question-gpt-oss-final","curation":"selected real Neuronpedia positions and layers","source_filename":"jlens-chat-gpt-oss-20b-2026-07-20T19-29-42-578Z.json","source_sha256":"fb0118460597cca14085018dfa1878c9171f74347a79d575bbd3852fc33198c9"}},"coverage":{"source_tokens_total":518,"transmitted_tokens":518,"instrumented_tokens":5,"truncated_tokens":513,"source_messages_total":2,"transmitted_messages":2,"context_window_limit":null,"truncated_message_indices":[],"capture_mode":"curated_demo_subset","requested_layers":[0,1,2,3,4,5,6,7,8,9,10,11,12,13,14,15,16,17,18,19,20,21,22,23],"captured_layers":[0,12,23],"status":"partial","warnings":["Curated subset; not a replacement for the immutable raw export."],"instrumented_generated_tokens":5}}
