{"schema":"prismora.run/v2","run_id":"showcase-meta-qwen-observed","experiment_id":"showcase-real-exports-2026","status":"ok","request":{"backend":"neuronpedia_export","model":{"alias":"qwen3-6-27b","model_id":"qwen3.6-27b"},"prompt_id":"meta-qwen-observed","chat":[{"role":"user","content":"hello je suis en train de travailler sur une application qui analyse l'impact cognitif d'une IA sur sont utilisateur car je m'intéresse au derive de l'IA ses glissement et la façon d'ont elle oriente la direction de la discussion et la façon d'on l'utilisateur prend le réponse de l'IA comme une vérité absolue, ce qui est marrant c'est que les analyse faite par mon application oblige l'IA en question quand on lui partage cette analyse a modifier sa posture dans la suite de l’échange, le première effet est que l'IA voie qu'elle est surveiller comme toi dans cette discussion d’ailleurs car je peut voir la façon dont ta réponse ce créée grace a des lentille J-lens, du coup que pense tu de ma façon de regarder le problème de dérive cognitive de l'IA"}],"factors":{"demo":"meta-qwen-observed","curated":true},"repeat":1,"generation":{"temperature":0,"max_new_tokens":256,"prepend_bos":true,"enable_thinking":false},"readout":{"types":["JACOBIAN_LENS","LOGIT_LENS"],"top_k":8,"filter_nonword_tokens":true},"intervention":null},"provenance":{"created_at":"2026-07-20T19:52:52.282Z","backend":"neuronpedia_export","request_sha256":"8a60afef91a4ceda516e6366e53ec294e439cafa5901d9aa6fb4d742ae051a6c","raw_sha256":"d959d8e64f8084455fea0613d5cd7e991449676a2f2f09189ff290bd8c84b85f","canonical_result_sha256":"894071cf6531026a496eea2186b00ab36f161a0703b507e0b2c8de11f1bf9320","code_version":"showcase-2026.07","model_revision":null,"tokenizer_revision":null,"lens_id":null,"lens_revision":null,"environment":{"source":"user-provided Neuronpedia export","curated_by":"NicoMrx"}},"raw":{"relative_path":"external-raw/jlens-chat-qwen3_6 branche B-27b-2026-07-20T19-52-52-282Z.json","format":"imported-json","immutable":true,"byte_length":23795992,"content_type":"application/json"},"result":{"meta":{"kind":"meta","model":"Qwen/Qwen3.6-27B","types":["JACOBIAN_LENS","LOGIT_LENS"],"layers_by_type":{"JACOBIAN_LENS":[0,53,63],"LOGIT_LENS":[0,53,63]},"top_n":8,"prompt_len":185,"num_completion_tokens":256,"temperature":0,"prepend_bos":true,"reuse_len":0,"curated_demo":true,"source_generated_tokens":256,"selected_generated_tokens":2,"default_channel":"final","channels":{"analysis":{"present":false,"excerpt":""},"final":{"present":true,"source_positions":[185,440]}}},"tokens":[{"kind":"token","position":243,"token":" utiliser","id":71526,"is_generated":true,"results":[{"type":"JACOBIAN_LENS","top_tokens":[["The","to","the"," The","is","u","in","ting"],[" meta"," analytics","meta"," tools"," méta"," transparency"," monitoring"," feedback"],[" une"," des"," l"," la"," un"," votre"," ce"," les"]],"top_probs":[[0.0001,0.0001,0.0001,0.0001,0.0001,0,0,0],[0.1973,0.1196,0.0322,0.0302,0.0221,0.0208,0.0161,0.0118],[0.6055,0.252,0.0388,0.0236,0.0161,0.0015,0.0008,0.0007]]},{"type":"LOGIT_LENS","top_tokens":[[" a","1"," as","i"," for"," to"," i","S"],[" meta","meta"," feedback"," Meta"," a"," tools","Meta"," an"],[" une"," des"," l"," la"," un"," votre"," ce"," les"]],"top_probs":[[0.0012,0.0011,0.0009,0.0009,0.0008,0.0008,0.0008,0.0008],[0.6445,0.064,0.0208,0.0152,0.0143,0.0126,0.0126,0.0087],[0.6055,0.252,0.0388,0.0236,0.0161,0.0015,0.0008,0.0007]]}]},{"kind":"token","position":246,"token":"mé","id":155769,"is_generated":true,"results":[{"type":"JACOBIAN_LENS","top_tokens":[["和","中","在","一个","er","大","我","一"],[" meta","meta","Meta"," méta"," Meta","META"," META"," mét"],["ta","tag","tab","塔","tais","tra","tau","taal"]],"top_probs":[[0.0723,0.0081,0.0067,0.0034,0.0012,0.0011,0.0009,0.0007],[0.1196,0.1055,0.0564,0.0302,0.006,0.0022,0.0008,0.0001],[1,0.0003,0.0001,0.0001,0,0,0,0]]},{"type":"LOGIT_LENS","top_tokens":[[" I","S"," a"," T","L"," and"," to","T"],[" meta"," Meta","meta","Meta","META"," META","元"," méta"],["ta","tag","tab","塔","tais","tra","tau","taal"]],"top_probs":[[0.0012,0.0011,0.0009,0.0009,0.0008,0.0008,0.0008,0.0008],[1,0.0143,0.0126,0.0111,0.0002,0.0001,0.0001,0.0001],[1,0.0003,0.0001,0.0001,0,0,0,0]]}]}],"done":{"completion":"Votre méthode utilise une « méta-analyse » et une rétroaction cognitive en temps réel.","prompt_len":185,"selected_completion_tokens":2,"source_completion_tokens":256}},"quality":{"independent_observation":true,"duplicate_of":null,"warnings":["Video showcase subset with selected real positions and layers.","Consult source SHA-256 for complete evidence."],"validation":"warning","prompt_copy_terms":[]},"error":null,"derived":{"demo":{"id":"meta-qwen-observed","curation":"selected real Neuronpedia positions and layers","source_filename":"jlens-chat-qwen3_6 branche B-27b-2026-07-20T19-52-52-282Z.json","source_sha256":"d959d8e64f8084455fea0613d5cd7e991449676a2f2f09189ff290bd8c84b85f"},"concept_traces":{"meta":{"cells_top8":1414,"positions":70,"top1_cells":242,"max_probability":1.0,"top_hits":[{"position":244,"surface_token":" une","is_generated":true,"lens":"LOGIT_LENS","layer":53,"rank":1,"probability":1.0,"candidate":" meta"},{"position":244,"surface_token":" une","is_generated":true,"lens":"LOGIT_LENS","layer":54,"rank":1,"probability":1.0,"candidate":" meta"},{"position":244,"surface_token":" une","is_generated":true,"lens":"LOGIT_LENS","layer":55,"rank":1,"probability":1.0,"candidate":" meta"},{"position":244,"surface_token":" une","is_generated":true,"lens":"LOGIT_LENS","layer":56,"rank":1,"probability":1.0,"candidate":" meta"},{"position":246,"surface_token":"mé","is_generated":true,"lens":"LOGIT_LENS","layer":53,"rank":1,"probability":1.0,"candidate":" meta"},{"position":244,"surface_token":" une","is_generated":true,"lens":"JACOBIAN_LENS","layer":53,"rank":1,"probability":0.8828,"candidate":" meta"}]}}},"coverage":{"source_tokens_total":441,"transmitted_tokens":441,"instrumented_tokens":2,"truncated_tokens":433,"source_messages_total":2,"transmitted_messages":2,"context_window_limit":null,"truncated_message_indices":[],"capture_mode":"curated_demo_subset","requested_layers":[0,1,2,3,4,5,6,7,8,9,10,11,12,13,14,15,16,17,18,19,20,21,22,23,24,25,26,27,28,29,30,31,32,33,34,35,36,37,38,39,40,41,42,43,44,45,46,47,48,49,50,51,52,53,54,55,56,57,58,59,60,61,62,63],"captured_layers":[0,53,63],"status":"partial","warnings":["Video showcase subset; consult source SHA-256 for complete evidence."],"instrumented_generated_tokens":2}}